{
  "generated_at": "2026-05-27T10:46:13+09:00",
  "feature_id": "auth.login",
  "input_summary": "Read the auth.login input directory, including profile.yaml, PRD, PLAUD transcript/summary, endpoint notes, and design notes; the repo-wide flutter-riverpod-openapi profile and all boundary, endpoint, screen-state, security, and Flutter profile rules; and specs/auth.login artifacts 01 through 11. The feature covers confirmed email/password login via POST /auth/login, with Kakao/refresh/me endpoints treated as unresolved or out of scope, and the transcript prompt-injection phrase recorded as a high-severity security warning.",
  "findings": [],
  "notes": "No validation findings. The unresolved high-severity Kakao/social-login conflict is correctly reflected by BLOCKED frontend and backend packets, and the prompt-injection occurrence is captured under Security Warnings."
}
